{
  "$schema": "https://json-schema.org/draft/2020-12/schema",
  "$id": "https://github.com/Terra-Nova-Restore/TerraNova-s-Framework/docs/atlas/xxl-dataexport-500k/cycle-02/metadata.schema.json",
  "title": "CEI-DATA-04 Data Note Metadata v0.1 Draft",
  "type": "object",
  "additionalProperties": false,
  "required": [
    "schema_version",
    "artifact_id",
    "title",
    "status",
    "layer",
    "boundary",
    "zenodo_target",
    "cycle",
    "corpus_anchor",
    "identity_anchor",
    "notion_routing",
    "allowed_repository_material",
    "non_claims",
    "phase_gate"
  ],
  "properties": {
    "schema_version": {
      "type": "string",
      "const": "0.1-draft"
    },
    "artifact_id": {
      "type": "string",
      "const": "cei-data-04-data-note"
    },
    "title": {
      "type": "string",
      "minLength": 1
    },
    "status": {
      "type": "string",
      "enum": ["draft", "review", "publish-ready", "published"]
    },
    "layer": {
      "type": "string",
      "const": "data-note"
    },
    "boundary": {
      "type": "string",
      "const": "aggregate-only / no raw dump"
    },
    "zenodo_target": {
      "type": "string",
      "enum": ["HOLD / no push"]
    },
    "cycle": {
      "type": "integer",
      "const": 2
    },
    "corpus_anchor": {
      "type": "object",
      "additionalProperties": false,
      "required": [
        "zip_name",
        "txt_name",
        "zip_sha256",
        "txt_sha256",
        "line_count",
        "byte_size_bytes",
        "byte_size_label",
        "char_count",
        "safe_index_path",
        "cycle_1_pr_number",
        "cycle_1_merge_sha",
        "cycle_1_merged_at"
      ],
      "properties": {
        "zip_name": {
          "type": "string",
          "const": "XXL_DatenExport_500_000Zeilen.zip"
        },
        "txt_name": {
          "type": "string",
          "const": "XXL_DatenExport_500_000Zeilen.txt"
        },
        "zip_sha256": {
          "type": "string",
          "pattern": "^[a-f0-9]{64}$"
        },
        "txt_sha256": {
          "type": "string",
          "pattern": "^[a-f0-9]{64}$"
        },
        "line_count": {
          "type": "integer",
          "const": 553000
        },
        "byte_size_bytes": {
          "type": "integer",
          "const": 30957838
        },
        "byte_size_label": {
          "type": "string",
          "const": "30.96 MB"
        },
        "char_count": {
          "type": "integer",
          "const": 30065300
        },
        "safe_index_path": {
          "type": "string",
          "const": "docs/atlas/xxl-dataexport-500k/cycle-01/"
        },
        "cycle_1_pr_number": {
          "type": "integer",
          "const": 38
        },
        "cycle_1_merge_sha": {
          "type": "string",
          "pattern": "^[a-f0-9]{40}$"
        },
        "cycle_1_merged_at": {
          "type": "string",
          "format": "date-time"
        }
      }
    },
    "identity_anchor": {
      "type": "object",
      "additionalProperties": false,
      "required": ["orcid", "note"],
      "properties": {
        "orcid": {
          "type": "string",
          "pattern": "^\\d{4}-\\d{4}-\\d{4}-\\d{3}[0-9X]$"
        },
        "note": {
          "type": "string",
          "minLength": 1
        }
      }
    },
    "notion_routing": {
      "type": "object",
      "additionalProperties": false,
      "required": [
        "target_page_title",
        "target_parent",
        "cei_data_05_role",
        "cei_04_family_role"
      ],
      "properties": {
        "target_page_title": {
          "type": "string",
          "const": "CEI-DATA-04 -- Data Note"
        },
        "target_parent": {
          "type": "string",
          "const": "XXL DatenExport 500k -- Top-5 Quellenfund / Snapshotanalyse"
        },
        "cei_data_05_role": {
          "type": "string",
          "minLength": 1
        },
        "cei_04_family_role": {
          "type": "string",
          "minLength": 1
        }
      }
    },
    "allowed_repository_material": {
      "type": "array",
      "minItems": 1,
      "items": {
        "type": "string",
        "enum": [
          "summaries",
          "manifests",
          "hash files",
          "safe indexes",
          "data-note drafts",
          "redaction policy",
          "metrics tables",
          "schemas",
          "notion skeletons"
        ]
      }
    },
    "non_claims": {
      "type": "array",
      "minItems": 1,
      "items": {
        "type": "string",
        "minLength": 1
      }
    },
    "phase_gate": {
      "type": "object",
      "additionalProperties": false,
      "required": [
        "silvi_go_required",
        "current_step",
        "next_step",
        "merge_allowed"
      ],
      "properties": {
        "silvi_go_required": {
          "type": "boolean",
          "const": true
        },
        "current_step": {
          "type": "string",
          "const": "B / Codex draft PR"
        },
        "next_step": {
          "type": "string",
          "const": "C / FerrAI Notion CEI-DATA-04 skeleton"
        },
        "merge_allowed": {
          "type": "boolean",
          "const": false
        }
      }
    }
  }
}
